{
  "$schema": "https://json-schema.org/draft/2020-12/schema",
  "$id": "https://massive.dev/conformance/schema/deployment-spec.schema.json",
  "title": "Massive DeploymentSpec",
  "description": "DeploymentSpec v1 binds a target profile to an immutable WorkflowPlan and materialization manifest identity. Bindings contain names, never credentials.",
  "type": "object",
  "additionalProperties": false,
  "required": ["kind", "schemaVersion", "encoding", "hashing", "deploymentHash", "planHash", "materializationHash", "profile"],
  "properties": {
    "kind": { "const": "DeploymentSpec" },
    "schemaVersion": { "const": 1 },
    "encoding": { "const": "json-v0" },
    "hashing": { "$ref": "#/$defs/hashing" },
    "deploymentHash": { "$ref": "#/$defs/hashRef" },
    "planHash": { "$ref": "#/$defs/hashRef" },
    "materializationHash": { "$ref": "#/$defs/hashRef" },
    "profile": { "$ref": "#/$defs/profile" }
  },
  "$defs": {
    "hashing": {
      "type": "object",
      "additionalProperties": false,
      "required": ["algorithm", "canonicalization", "recipe", "recipeVersion"],
      "properties": {
        "algorithm": { "const": "sha256" },
        "canonicalization": { "const": "canonical-json-v0" },
        "recipe": { "const": "deployment-spec" },
        "recipeVersion": { "const": 1 }
      }
    },
    "hashRef": {
      "type": "string",
      "pattern": "^sha256:[0-9a-f]{64}$"
    },
    "id": {
      "type": "string",
      "minLength": 1,
      "maxLength": 64,
      "pattern": "^[A-Za-z0-9_.@/:#-]+$"
    },
    "bindingId": {
      "type": "string",
      "minLength": 1,
      "maxLength": 64,
      "pattern": "^[A-Za-z][A-Za-z0-9_.-]*$"
    },
    "profile": {
      "type": "object",
      "additionalProperties": false,
      "required": ["name", "artifactStoreBinding", "target"],
      "properties": {
        "name": { "$ref": "#/$defs/id" },
        "artifactStoreBinding": { "$ref": "#/$defs/bindingId" },
        "target": { "$ref": "#/$defs/target" }
      }
    },
    "target": {
      "type": "object",
      "required": ["kind"],
      "properties": { "kind": { "enum": ["local", "argo"] } },
      "allOf": [
        { "if": { "required": ["kind"], "properties": { "kind": { "const": "local" } } }, "then": { "$ref": "#/$defs/localTarget" } },
        { "if": { "required": ["kind"], "properties": { "kind": { "const": "argo" } } }, "then": { "$ref": "#/$defs/argoTarget" } }
      ]
    },
    "localTarget": {
      "type": "object",
      "additionalProperties": false,
      "required": ["kind"],
      "properties": {
        "kind": { "const": "local" }
      }
    },
    "dnsSubdomain": {
      "type": "string",
      "pattern": "^[a-z0-9]([-a-z0-9]*[a-z0-9])?(\\.[a-z0-9]([-a-z0-9]*[a-z0-9])?)*$",
      "maxLength": 253
    },
    "secretKeyRef": {
      "type": "object",
      "additionalProperties": false,
      "required": ["name", "key"],
      "properties": {
        "name": { "$ref": "#/$defs/dnsSubdomain" },
        "key": { "type": "string", "pattern": "^[A-Za-z0-9_.-]+$", "maxLength": 253, "not": { "pattern": "^(\\.$|\\.\\.)" } }
      }
    },
    "secretBindings": {
      "type": "object",
      "propertyNames": { "minLength": 1 },
      "additionalProperties": { "$ref": "#/$defs/secretKeyRef" }
    },
    "argoTarget": {
      "type": "object",
      "additionalProperties": false,
      "required": ["kind", "namespace", "serviceAccountName", "runtimeTransport"],
      "properties": {
        "kind": { "const": "argo" },
        "runtimeTransport": { "enum": ["embedded-v0", "object-store-v0"] },
        "namespace": { "$ref": "#/$defs/id" },
        "serviceAccountName": { "$ref": "#/$defs/id" },
        "workflowTemplateName": { "$ref": "#/$defs/id" },
        "secretBindings": { "$ref": "#/$defs/secretBindings" },
        "artifactCredentialsSecret": { "$ref": "#/$defs/dnsSubdomain" },
        "placement": { "$ref": "#/$defs/placement" }
      }
    },
    "placement": {
      "description": "Pod placement and metadata. defaults apply to every pod; a nodes entry overrides them for the pods that run that step or map node's author code.",
      "type": "object",
      "additionalProperties": false,
      "minProperties": 1,
      "properties": {
        "defaults": { "$ref": "#/$defs/podPlacement" },
        "nodes": {
          "type": "object",
          "minProperties": 1,
          "propertyNames": { "minLength": 1, "maxLength": 128 },
          "additionalProperties": { "$ref": "#/$defs/podPlacement" }
        }
      }
    },
    "podPlacement": {
      "description": "Kubernetes values are checked against the pinned Argo schema with unknown fields rejected. Label and annotation keys under massive.dev and argoproj.io belong to the generated workflow.",
      "type": "object",
      "additionalProperties": false,
      "minProperties": 1,
      "properties": {
        "nodeSelector": {
          "description": "kubernetes.io/os and kubernetes.io/arch come from the plan's container platform.",
          "type": "object",
          "minProperties": 1,
          "propertyNames": { "$ref": "#/$defs/labelKey" },
          "properties": { "kubernetes.io/os": false, "kubernetes.io/arch": false },
          "additionalProperties": { "$ref": "#/$defs/labelValue" }
        },
        "affinity": { "$ref": "https://raw.githubusercontent.com/argoproj/argo-workflows/HEAD/api/jsonschema/schema.json#/definitions/io.k8s.api.core.v1.Affinity" },
        "tolerations": { "type": "array", "minItems": 1, "items": { "$ref": "#/$defs/toleration" } },
        "runtimeClassName": { "$ref": "#/$defs/dnsSubdomain" },
        "priorityClassName": { "$ref": "#/$defs/dnsSubdomain" },
        "labels": {
          "type": "object",
          "minProperties": 1,
          "propertyNames": { "$ref": "#/$defs/labelKey" },
          "patternProperties": { "^([^/]*\\.)?(massive\\.dev|argoproj\\.io)/": false },
          "additionalProperties": { "$ref": "#/$defs/labelValue" }
        },
        "annotations": {
          "type": "object",
          "minProperties": 1,
          "propertyNames": { "$ref": "#/$defs/labelKey" },
          "patternProperties": { "^([^/]*\\.)?(massive\\.dev|argoproj\\.io)/": false },
          "additionalProperties": { "type": "string" }
        },
        "podSpecPatch": { "$ref": "#/$defs/podSpecPatch" }
      }
    },
    "labelKey": {
      "type": "string",
      "maxLength": 317,
      "pattern": "^([a-z0-9]([-a-z0-9]*[a-z0-9])?(\\.[a-z0-9]([-a-z0-9]*[a-z0-9])?)*/)?[A-Za-z0-9]([-A-Za-z0-9_.]{0,61}[A-Za-z0-9])?$"
    },
    "labelValue": { "type": "string", "maxLength": 63, "pattern": "^([A-Za-z0-9]([-A-Za-z0-9_.]*[A-Za-z0-9])?)?$" },
    "toleration": {
      "$ref": "https://raw.githubusercontent.com/argoproj/argo-workflows/HEAD/api/jsonschema/schema.json#/definitions/io.k8s.api.core.v1.Toleration",
      "properties": {
        "operator": { "enum": ["Exists", "Equal"] },
        "effect": { "enum": ["NoSchedule", "PreferNoSchedule", "NoExecute"] }
      },
      "if": { "required": ["operator"], "properties": { "operator": { "const": "Exists" } } },
      "then": { "properties": { "value": { "maxLength": 0 } } }
    },
    "podSpecPatch": {
      "description": "A strategic merge patch over the generated pod spec. Typed placement fields, identity, volumes, and the main container's image, command, environment, CPU, and memory are not patchable.",
      "type": "object",
      "additionalProperties": false,
      "minProperties": 1,
      "properties": {
        "containers": { "type": "array", "minItems": 1, "maxItems": 1, "items": { "$ref": "#/$defs/mainContainerPatch" } },
        "securityContext": { "$ref": "#/$defs/podHardening" },
        "dnsPolicy": { "enum": ["ClusterFirst", "ClusterFirstWithHostNet", "Default", "None"] },
        "dnsConfig": { "$ref": "https://raw.githubusercontent.com/argoproj/argo-workflows/HEAD/api/jsonschema/schema.json#/definitions/io.k8s.api.core.v1.PodDNSConfig" },
        "hostAliases": { "type": "array", "minItems": 1, "items": { "$ref": "https://raw.githubusercontent.com/argoproj/argo-workflows/HEAD/api/jsonschema/schema.json#/definitions/io.k8s.api.core.v1.HostAlias" } },
        "imagePullSecrets": { "type": "array", "minItems": 1, "items": { "$ref": "https://raw.githubusercontent.com/argoproj/argo-workflows/HEAD/api/jsonschema/schema.json#/definitions/io.k8s.api.core.v1.LocalObjectReference" } },
        "schedulerName": { "$ref": "#/$defs/dnsSubdomain" },
        "terminationGracePeriodSeconds": { "type": "integer", "minimum": 0 }
      }
    },
    "mainContainerPatch": {
      "type": "object",
      "additionalProperties": false,
      "required": ["name"],
      "minProperties": 2,
      "properties": {
        "name": { "const": "main" },
        "resources": {
          "type": "object",
          "additionalProperties": false,
          "minProperties": 1,
          "properties": { "requests": { "$ref": "#/$defs/extendedResources" }, "limits": { "$ref": "#/$defs/extendedResources" } }
        },
        "securityContext": { "$ref": "#/$defs/containerHardening" }
      }
    },
    "extendedResources": {
      "description": "Extended resources such as GPUs. CPU and memory are execution requirements in the plan.",
      "type": "object",
      "minProperties": 1,
      "propertyNames": {
        "description": "Kubernetes IsExtendedResourceName: non-native, no requests. prefix, and requests.<name> must be a qualified quota name (domain at most 244 characters).",
        "allOf": [
          { "$ref": "#/$defs/labelKey" },
          { "pattern": "^[^/]{1,244}/" },
          { "not": { "pattern": "(^requests\\.|kubernetes\\.io/)" } }
        ]
      },
      "properties": { "cpu": false, "memory": false },
      "additionalProperties": { "$ref": "https://raw.githubusercontent.com/argoproj/argo-workflows/HEAD/api/jsonschema/schema.json#/definitions/io.k8s.apimachinery.pkg.api.resource.Quantity" }
    },
    "hardeningProfile": {
      "type": "object",
      "additionalProperties": false,
      "required": [
        "type"
      ],
      "properties": {
        "type": {
          "enum": [
            "RuntimeDefault",
            "Localhost"
          ]
        },
        "localhostProfile": {
          "type": "string",
          "minLength": 1
        }
      },
      "if": {
        "properties": {
          "type": {
            "const": "Localhost"
          }
        }
      },
      "then": {
        "required": [
          "localhostProfile"
        ]
      },
      "else": {
        "properties": {
          "localhostProfile": false
        }
      }
    },
    "podHardening": {
      "description": "Hardening only; placement cannot grant pod privileges.",
      "type": "object",
      "additionalProperties": false,
      "minProperties": 1,
      "properties": {
        "runAsNonRoot": {
          "const": true
        },
        "runAsUser": {
          "type": "integer",
          "minimum": 1
        },
        "runAsGroup": {
          "type": "integer",
          "minimum": 1
        },
        "seccompProfile": {
          "$ref": "#/$defs/hardeningProfile"
        },
        "appArmorProfile": {
          "$ref": "#/$defs/hardeningProfile"
        }
      }
    },
    "containerHardening": {
      "description": "Hardening only; placement cannot grant container privileges.",
      "type": "object",
      "additionalProperties": false,
      "minProperties": 1,
      "properties": {
        "runAsNonRoot": {
          "const": true
        },
        "runAsUser": {
          "type": "integer",
          "minimum": 1
        },
        "runAsGroup": {
          "type": "integer",
          "minimum": 1
        },
        "seccompProfile": {
          "$ref": "#/$defs/hardeningProfile"
        },
        "appArmorProfile": {
          "$ref": "#/$defs/hardeningProfile"
        },
        "privileged": {
          "const": false
        },
        "allowPrivilegeEscalation": {
          "const": false
        },
        "readOnlyRootFilesystem": {
          "const": true
        },
        "capabilities": {
          "type": "object",
          "additionalProperties": false,
          "required": [
            "drop"
          ],
          "properties": {
            "drop": {
              "type": "array",
              "minItems": 1,
              "uniqueItems": true,
              "items": {
                "type": "string",
                "pattern": "^[A-Z][A-Z0-9_]*$"
              }
            }
          }
        }
      }
    }
  }
}
