{
  "kind": "DeploymentSpec",
  "schemaVersion": 1,
  "encoding": "json-v0",
  "hashing": {
    "algorithm": "sha256",
    "canonicalization": "canonical-json-v0",
    "recipe": "deployment-spec",
    "recipeVersion": 1
  },
  "planHash": "sha256:1111111111111111111111111111111111111111111111111111111111111111",
  "materializationHash": "sha256:2222222222222222222222222222222222222222222222222222222222222222",
  "profile": {
    "name": "argo-staging",
    "artifactStoreBinding": "staging-artifacts",
    "target": {
      "kind": "argo",
      "namespace": "staging",
      "serviceAccountName": "massive-runner",
      "runtimeTransport": "object-store-v0",
      "workflowTemplateName": "example-workflow"
    }
  },
  "deploymentHash": "sha256:9872000e1453dfaaa55e531ffa30d6d48b5d6a6fb3e0f7eb4e42ba57cf94a578"
}
